,Title,Clean Title,Title Tokenized,Title Wordnet Pos,Title Lemmatized,Content,Clean Content,Text Tokenized,Text Wordnet Pos,Text Lemmatized,Rating,Sentiment,Target
77,"Buy something else, seriously.",buy something else seriously,"['buy', 'something', 'else', 'seriously']","[('buy', 'v'), ('something', 'n'), ('else', 'r'), ('seriously', 'r')]","['buy', 'something', 'else', 'seriously']","Ok - So they seem ok at face value, quite bulky on the part that sticks out the ear, but for £39.99 You can live with that.I use them for road riding (cycling) didn’t want to invest in an expensive pair because I was worried they might fall out at high speeds or with wind, they stayed solid for that which was good,However, when you put the hammer down and clench your jaw during a climb for example, the movement of my jaw caused the left one to fall out, 35 miles in so it wasn’t due to poor fit.Next 3 times were indoors on a turbo trainer and both of them fell out at separate times, once during light use.I use the smallest buds as my ear canals are small, I find them uncomfortable, a nightmare to seat correctly, and after a couple of hours on the bike I find I’ve got a blister like sore on the inside of my ear where the bud sits.I’m aware this could be down to my ear and not the headphones but I’ve had some £150 let’s say Sneats by Dr Stay, and they were fine, no pain - they just died a","ok seem ok face value quite bulky part sticks ear three thousand, nine hundred and ninety-nine live thati use road riding cycling want invest expensive pair worried might fall high speeds wind stayed solid goodhowever put hammer clench jaw climb example movement jaw caused left one fall thirty-five miles due poor fitnext three times indoors turbo trainer fell separate times light usei use smallest buds ear canals small find uncomfortable nightmare seat correctly couple hours bike find got blister like sore inside ear bud sitsi aware could ear headphones one hundred and fifty let us say sneats dr stay fine pain died","['ok', 'seem', 'ok', 'face', 'value', 'quite', 'bulky', 'part', 'sticks', 'ear', 'three', 'thousand', ',', 'nine', 'hundred', 'and', 'ninety-nine', 'live', 'thati', 'use', 'road', 'riding', 'cycling', 'want', 'invest', 'expensive', 'pair', 'worried', 'might', 'fall', 'high', 'speeds', 'wind', 'stayed', 'solid', 'goodhowever', 'put', 'hammer', 'clench', 'jaw', 'climb', 'example', 'movement', 'jaw', 'caused', 'left', 'one', 'fall', 'thirty-five', 'miles', 'due', 'poor', 'fitnext', 'three', 'times', 'indoors', 'turbo', 'trainer', 'fell', 'separate', 'times', 'light', 'usei', 'use', 'smallest', 'buds', 'ear', 'canals', 'small', 'find', 'uncomfortable', 'nightmare', 'seat', 'correctly', 'couple', 'hours', 'bike', 'find', 'got', 'blister', 'like', 'sore', 'inside', 'ear', 'bud', 'sitsi', 'aware', 'could', 'ear', 'headphones', 'one', 'hundred', 'and', 'fifty', 'let', 'us', 'say', 'sneats', 'dr', 'stay', 'fine', 'pain', 'died']","[('ok', 'a'), ('seem', 'v'), ('ok', 'a'), ('face', 'n'), ('value', 'n'), ('quite', 'r'), ('bulky', 'a'), ('part', 'n'), ('sticks', 'n'), ('ear', 'v'), ('three', 'n'), ('thousand', 'n'), (',', 'n'), ('nine', 'n'), ('hundred', 'v'), ('and', 'n'), ('ninety-nine', 'a'), ('live', 'a'), ('thati', 'n'), ('use', 'n'), ('road', 'n'), ('riding', 'v'), ('cycling', 'v'), ('want', 'a'), ('invest', 'n'), ('expensive', 'a'), ('pair', 'n'), ('worried', 'v'), ('might', 'n'), ('fall', 'v'), ('high', 'a'), ('speeds', 'n'), ('wind', 'v'), ('stayed', 'a'), ('solid', 'a'), ('goodhowever', 'n'), ('put', 'v'), ('hammer', 'a'), ('clench', 'n'), ('jaw', 'n'), ('climb', 'n'), ('example', 'n'), ('movement', 'n'), ('jaw', 'n'), ('caused', 'v'), ('left', 'v'), ('one', 'n'), ('fall', 'n'), ('thirty-five', 'a'), ('miles', 'n'), ('due', 'a'), ('poor', 'a'), ('fitnext', 'a'), ('three', 'n'), ('times', 'n'), ('indoors', 'n'), ('turbo', 'v'), ('trainer', 'n'), ('fell', 'v'), ('separate', 'a'), ('times', 'n'), ('light', 'a'), ('usei', 'a'), ('use', 'n'), ('smallest', 'a'), ('buds', 'n'), ('ear', 'a'), ('canals', 'n'), ('small', 'a'), ('find', 'v'), ('uncomfortable', 'a'), ('nightmare', 'a'), ('seat', 'n'), ('correctly', 'r'), ('couple', 'a'), ('hours', 'n'), ('bike', 'n'), ('find', 'v'), ('got', 'a'), ('blister', 'n'), ('like', 'n'), ('sore', 'n'), ('inside', 'n'), ('ear', 'a'), ('bud', 'n'), ('sitsi', 'n'), ('aware', 'n'), ('could', 'n'), ('ear', 'v'), ('headphones', 'n'), ('one', 'n'), ('hundred', 'n'), ('and', 'n'), ('fifty', 'a'), ('let', 'v'), ('us', 'n'), ('say', 'v'), ('sneats', 'n'), ('dr', 'v'), ('stay', 'a'), ('fine', 'a'), ('pain', 'n'), ('died', 'v')]","['ok', 'seem', 'ok', 'face', 'value', 'quite', 'bulky', 'part', 'stick', 'ear', 'three', 'thousand', ',', 'nine', 'hundred', 'and', 'ninety-nine', 'live', 'thati', 'use', 'road', 'rid', 'cycle', 'want', 'invest', 'expensive', 'pair', 'worry', 'might', 'fall', 'high', 'speed', 'wind', 'stayed', 'solid', 'goodhowever', 'put', 'hammer', 'clench', 'jaw', 'climb', 'example', 'movement', 'jaw', 'cause', 'leave', 'one', 'fall', 'thirty-five', 'mile', 'due', 'poor', 'fitnext', 'three', 'time', 'indoors', 'turbo', 'trainer', 'fell', 'separate', 'time', 'light', 'usei', 'use', 'small', 'bud', 'ear', 'canal', 'small', 'find', 'uncomfortable', 'nightmare', 'seat', 'correctly', 'couple', 'hour', 'bike', 'find', 'got', 'blister', 'like', 'sore', 'inside', 'ear', 'bud', 'sitsi', 'aware', 'could', 'ear', 'headphone', 'one', 'hundred', 'and', 'fifty', 'let', 'u', 'say', 'sneats', 'dr', 'stay', 'fine', 'pain', 'die']",3,Neutral,1
78,Extremely impressed!,extremely impressed,"['extremely', 'impressed']","[('extremely', 'r'), ('impressed', 'a')]","['extremely', 'impressed']","There is no point in comparing them with Apple products or any other products, why, because they are brilliant and at this price ,especially with the 30% off , they are probably the best wireless earbuds you can buy (even better than more expensive ones). I bought them for my wife and she's hearing disabled (one ear 82% off and the other one 55% off) so you can imagine my thoughts about the earbuds, but after charging them and use them for about 1 hour she was in heaven with tears in her eyes, i can hear my songs sharp and clear( with the volume at maximum and some tweaks in the phone 🧐) she said ,and i was relieved that my search finally ended 😁. Now her testimony: ""They are amazing i can finally hear my songs clear and the fact that they stay perfect and cover my whole ear it's brilliant, it's like a noise canceling thing, the songs are sharp and clear the bass a bit low (but that's good for her condition) and when I'm speaking on the phone i can hear clearly the other person, i love",point comparing apple products products brilliant price especially thirty probably best wireless earbuds buy even better expensive ones bought wife hearing disabled one ear eighty-two one fifty-five imagine thoughts earbuds charging use one hour heaven tears eyes hear songs sharp clear volume maximum tweaks phone said relieved search finally ended testimony amazing finally hear songs clear fact stay perfect cover whole ear brilliant like noise canceling thing songs sharp clear bass bit low good condition speaking phone hear clearly person love,"['point', 'comparing', 'apple', 'products', 'products', 'brilliant', 'price', 'especially', 'thirty', 'probably', 'best', 'wireless', 'earbuds', 'buy', 'even', 'better', 'expensive', 'ones', 'bought', 'wife', 'hearing', 'disabled', 'one', 'ear', 'eighty-two', 'one', 'fifty-five', 'imagine', 'thoughts', 'earbuds', 'charging', 'use', 'one', 'hour', 'heaven', 'tears', 'eyes', 'hear', 'songs', 'sharp', 'clear', 'volume', 'maximum', 'tweaks', 'phone', 'said', 'relieved', 'search', 'finally', 'ended', 'testimony', 'amazing', 'finally', 'hear', 'songs', 'clear', 'fact', 'stay', 'perfect', 'cover', 'whole', 'ear', 'brilliant', 'like', 'noise', 'canceling', 'thing', 'songs', 'sharp', 'clear', 'bass', 'bit', 'low', 'good', 'condition', 'speaking', 'phone', 'hear', 'clearly', 'person', 'love']","[('point', 'n'), ('comparing', 'v'), ('apple', 'n'), ('products', 'n'), ('products', 'n'), ('brilliant', 'a'), ('price', 'n'), ('especially', 'r'), ('thirty', 'v'), ('probably', 'r'), ('best', 'a'), ('wireless', 'n'), ('earbuds', 'n'), ('buy', 'v'), ('even', 'r'), ('better', 'r'), ('expensive', 'a'), ('ones', 'n'), ('bought', 'v'), ('wife', 'n'), ('hearing', 'n'), ('disabled', 'v'), ('one', 'n'), ('ear', 'a'), ('eighty-two', 'a'), ('one', 'n'), ('fifty-five', 'a'), ('imagine', 'n'), ('thoughts', 'n'), ('earbuds', 'v'), ('charging', 'v'), ('use', 'n'), ('one', 'n'), ('hour', 'n'), ('heaven', 'n'), ('tears', 'n'), ('eyes', 'v'), ('hear', 'a'), ('songs', 'n'), ('sharp', 'a'), ('clear', 'a'), ('volume', 'n'), ('maximum', 'a'), ('tweaks', 'n'), ('phone', 'n'), ('said', 'v'), ('relieved', 'v'), ('search', 'n'), ('finally', 'r'), ('ended', 'v'), ('testimony', 'n'), ('amazing', 'v'), ('finally', 'r'), ('hear', 'a'), ('songs', 'n'), ('clear', 'a'), ('fact', 'n'), ('stay', 'v'), ('perfect', 'a'), ('cover', 'n'), ('whole', 'a'), ('ear', 'a'), ('brilliant', 'n'), ('like', 'n'), ('noise', 'n'), ('canceling', 'v'), ('thing', 'n'), ('songs', 'n'), ('sharp', 'a'), ('clear', 'a'), ('bass', 'n'), ('bit', 'n'), ('low', 'a'), ('good', 'a'), ('condition', 'n'), ('speaking', 'v'), ('phone', 'n'), ('hear', 'v'), ('clearly', 'r'), ('person', 'n'), ('love', 'v')]","['point', 'compare', 'apple', 'product', 'product', 'brilliant', 'price', 'especially', 'thirty', 'probably', 'best', 'wireless', 'earbuds', 'buy', 'even', 'well', 'expensive', 'one', 'buy', 'wife', 'hearing', 'disable', 'one', 'ear', 'eighty-two', 'one', 'fifty-five', 'imagine', 'thought', 'earbuds', 'charge', 'use', 'one', 'hour', 'heaven', 'tear', 'eye', 'hear', 'song', 'sharp', 'clear', 'volume', 'maximum', 'tweak', 'phone', 'say', 'relieve', 'search', 'finally', 'end', 'testimony', 'amaze', 'finally', 'hear', 'song', 'clear', 'fact', 'stay', 'perfect', 'cover', 'whole', 'ear', 'brilliant', 'like', 'noise', 'cancel', 'thing', 'song', 'sharp', 'clear', 'bass', 'bit', 'low', 'good', 'condition', 'speak', 'phone', 'hear', 'clearly', 'person', 'love']",5,Positive,2
79,Love the colour,love colour,"['love', 'colour']","[('love', 'v'), ('colour', 'n')]","['love', 'colour']",They don't sit comfortably in the ear but the sound quality is good.,sit comfortably ear sound quality good,"['sit', 'comfortably', 'ear', 'sound', 'quality', 'good']","[('sit', 'n'), ('comfortably', 'r'), ('ear', 'a'), ('sound', 'a'), ('quality', 'n'), ('good', 'a')]","['sit', 'comfortably', 'ear', 'sound', 'quality', 'good']",4,Positive,2
80,Perfect,perfect,['perfect'],"[('perfect', 'n')]",['perfect'],"I've had these before but one bud stopped working so I bought 2 others, I've tried 3 different ones in total but I find these earphones to be the best better than jbl and anker, which I had high expectations of but the controls were confusing. These earphones are perfect so far, they're snug, hidden, fits well, doesn't fall out and its easy to control",one bud stopped working bought two others tried three different ones total find earphones best better jbl anker high expectations controls confusing earphones perfect far snug hidden fits well fall easy control,"['one', 'bud', 'stopped', 'working', 'bought', 'two', 'others', 'tried', 'three', 'different', 'ones', 'total', 'find', 'earphones', 'best', 'better', 'jbl', 'anker', 'high', 'expectations', 'controls', 'confusing', 'earphones', 'perfect', 'far', 'snug', 'hidden', 'fits', 'well', 'fall', 'easy', 'control']","[('one', 'n'), ('bud', 'n'), ('stopped', 'v'), ('working', 'v'), ('bought', 'v'), ('two', 'n'), ('others', 'n'), ('tried', 'v'), ('three', 'n'), ('different', 'a'), ('ones', 'n'), ('total', 'a'), ('find', 'v'), ('earphones', 'a'), ('best', 'r'), ('better', 'r'), ('jbl', 'n'), ('anker', 'n'), ('high', 'a'), ('expectations', 'n'), ('controls', 'n'), ('confusing', 'v'), ('earphones', 'n'), ('perfect', 'v'), ('far', 'r'), ('snug', 'a'), ('hidden', 'a'), ('fits', 'n'), ('well', 'r'), ('fall', 'v'), ('easy', 'a'), ('control', 'n')]","['one', 'bud', 'stop', 'work', 'buy', 'two', 'others', 'try', 'three', 'different', 'one', 'total', 'find', 'earphones', 'best', 'well', 'jbl', 'anker', 'high', 'expectation', 'control', 'confuse', 'earphone', 'perfect', 'far', 'snug', 'hidden', 'fit', 'well', 'fall', 'easy', 'control']",5,Positive,2
81,Fall out the ear too easily,fall ear easily,"['fall', 'ear', 'easily']","[('fall', 'n'), ('ear', 'v'), ('easily', 'r')]","['fall', 'ear', 'easily']",I dont want to complain too much as they are cheap and you get what you pay for.My main issue with them are they fall out the ear to easily there is no way you could go for a jog or run with them.Other than that I'm happy with them as I own them but would not purchase them again due to what I said above,want complain much cheap get pay formy main issue fall ear easily way could go jog run themother happy would purchase due said,"['want', 'complain', 'much', 'cheap', 'get', 'pay', 'formy', 'main', 'issue', 'fall', 'ear', 'easily', 'way', 'could', 'go', 'jog', 'run', 'themother', 'happy', 'would', 'purchase', 'due', 'said']","[('want', 'v'), ('complain', 'n'), ('much', 'a'), ('cheap', 'a'), ('get', 'n'), ('pay', 'n'), ('formy', 'n'), ('main', 'a'), ('issue', 'n'), ('fall', 'n'), ('ear', 'v'), ('easily', 'r'), ('way', 'n'), ('could', 'n'), ('go', 'v'), ('jog', 'a'), ('run', 'n'), ('themother', 'r'), ('happy', 'a'), ('would', 'n'), ('purchase', 'v'), ('due', 'r'), ('said', 'v')]","['want', 'complain', 'much', 'cheap', 'get', 'pay', 'formy', 'main', 'issue', 'fall', 'ear', 'easily', 'way', 'could', 'go', 'jog', 'run', 'themother', 'happy', 'would', 'purchase', 'due', 'say']",3,Neutral,1
82,Highly recommended & quality premium headset,highly recommended quality premium headset,"['highly', 'recommended', 'quality', 'premium', 'headset']","[('highly', 'r'), ('recommended', 'a'), ('quality', 'n'), ('premium', 'n'), ('headset', 'n')]","['highly', 'recommended', 'quality', 'premium', 'headset']","I was looking to purchase Apple Airpods however could not justify the high end price for them which is crazy. After some research I decided to purchase the Tozo T6 due to great reviews but also I had a few Tozo accessories which were brillant quality.When the parcel arrived, quickly opened the packaging. WOW first impressions was really good. Everything inside the box had it's own compartment, unlike other branded headsets reviews I read which the headsets, charging cable, etc is just dumped in a box.The charging case feel really nice - smooth finish. It has weight which personally I like because its feels like you are holding something in your hand. The led lights are very visible & bright so you know the charge.The headsets look are brillant - they are much smaller then the images which is cool. Once you open the case, I went into iPhone bluetooth settings are paired straight away. Not hassle. Used then for 4.5 hours which is really good battery life.The quality of these headsets are",looking purchase apple airpods however could justify high end price crazy research decided purchase tozo t6 due great reviews also tozo accessories brillant qualitywhen parcel arrived quickly opened packaging wow first impressions really good everything inside box compartment unlike branded headsets reviews read headsets charging cable etc dumped boxthe charging case feel really nice smooth finish weight personally like feels like holding something hand led lights visible bright know chargethe headsets look brillant much smaller images cool open case went iphone bluetooth settings paired straight away hassle used forty-five hours really good battery lifethe quality headsets,"['looking', 'purchase', 'apple', 'airpods', 'however', 'could', 'justify', 'high', 'end', 'price', 'crazy', 'research', 'decided', 'purchase', 'tozo', 't6', 'due', 'great', 'reviews', 'also', 'tozo', 'accessories', 'brillant', 'qualitywhen', 'parcel', 'arrived', 'quickly', 'opened', 'packaging', 'wow', 'first', 'impressions', 'really', 'good', 'everything', 'inside', 'box', 'compartment', 'unlike', 'branded', 'headsets', 'reviews', 'read', 'headsets', 'charging', 'cable', 'etc', 'dumped', 'boxthe', 'charging', 'case', 'feel', 'really', 'nice', 'smooth', 'finish', 'weight', 'personally', 'like', 'feels', 'like', 'holding', 'something', 'hand', 'led', 'lights', 'visible', 'bright', 'know', 'chargethe', 'headsets', 'look', 'brillant', 'much', 'smaller', 'images', 'cool', 'open', 'case', 'went', 'iphone', 'bluetooth', 'settings', 'paired', 'straight', 'away', 'hassle', 'used', 'forty-five', 'hours', 'really', 'good', 'battery', 'lifethe', 'quality', 'headsets']","[('looking', 'v'), ('purchase', 'n'), ('apple', 'n'), ('airpods', 'n'), ('however', 'r'), ('could', 'n'), ('justify', 'v'), ('high', 'a'), ('end', 'n'), ('price', 'n'), ('crazy', 'a'), ('research', 'n'), ('decided', 'v'), ('purchase', 'n'), ('tozo', 'n'), ('t6', 'n'), ('due', 'a'), ('great', 'a'), ('reviews', 'n'), ('also', 'r'), ('tozo', 'v'), ('accessories', 'n'), ('brillant', 'v'), ('qualitywhen', 'a'), ('parcel', 'n'), ('arrived', 'v'), ('quickly', 'r'), ('opened', 'v'), ('packaging', 'n'), ('wow', 'n'), ('first', 'a'), ('impressions', 'n'), ('really', 'r'), ('good', 'a'), ('everything', 'n'), ('inside', 'n'), ('box', 'n'), ('compartment', 'n'), ('unlike', 'n'), ('branded', 'v'), ('headsets', 'n'), ('reviews', 'v'), ('read', 'a'), ('headsets', 'n'), ('charging', 'v'), ('cable', 'n'), ('etc', 'n'), ('dumped', 'v'), ('boxthe', 'n'), ('charging', 'v'), ('case', 'n'), ('feel', 'v'), ('really', 'r'), ('nice', 'a'), ('smooth', 'n'), ('finish', 'a'), ('weight', 'n'), ('personally', 'r'), ('like', 'a'), ('feels', 'n'), ('like', 'n'), ('holding', 'v'), ('something', 'n'), ('hand', 'n'), ('led', 'v'), ('lights', 'n'), ('visible', 'a'), ('bright', 'a'), ('know', 'v'), ('chargethe', 'a'), ('headsets', 'n'), ('look', 'v'), ('brillant', 'a'), ('much', 'a'), ('smaller', 'a'), ('images', 'n'), ('cool', 'v'), ('open', 'a'), ('case', 'n'), ('went', 'v'), ('iphone', 'n'), ('bluetooth', 'n'), ('settings', 'n'), ('paired', 'v'), ('straight', 'r'), ('away', 'r'), ('hassle', 'a'), ('used', 'v'), ('forty-five', 'a'), ('hours', 'n'), ('really', 'r'), ('good', 'a'), ('battery', 'n'), ('lifethe', 'n'), ('quality', 'n'), ('headsets', 'n')]","['look', 'purchase', 'apple', 'airpods', 'however', 'could', 'justify', 'high', 'end', 'price', 'crazy', 'research', 'decide', 'purchase', 'tozo', 't6', 'due', 'great', 'review', 'also', 'tozo', 'accessory', 'brillant', 'qualitywhen', 'parcel', 'arrive', 'quickly', 'open', 'packaging', 'wow', 'first', 'impression', 'really', 'good', 'everything', 'inside', 'box', 'compartment', 'unlike', 'brand', 'headset', 'review', 'read', 'headset', 'charge', 'cable', 'etc', 'dump', 'boxthe', 'charge', 'case', 'feel', 'really', 'nice', 'smooth', 'finish', 'weight', 'personally', 'like', 'feel', 'like', 'hold', 'something', 'hand', 'lead', 'light', 'visible', 'bright', 'know', 'chargethe', 'headset', 'look', 'brillant', 'much', 'small', 'image', 'cool', 'open', 'case', 'go', 'iphone', 'bluetooth', 'setting', 'pair', 'straight', 'away', 'hassle', 'use', 'forty-five', 'hour', 'really', 'good', 'battery', 'lifethe', 'quality', 'headset']",5,Positive,2
83,Loved So Much I Bought A 2nd Pair,loved much bought 2nd pair,"['loved', 'much', 'bought', '2nd', 'pair']","[('loved', 'v'), ('much', 'a'), ('bought', 'v'), ('2nd', 'n'), ('pair', 'n')]","['love', 'much', 'buy', '2nd', 'pair']","These are the only earbuds I use.I was gifted a pink pair a few years ago and I use them all the time. The earbuds have held up over several holidays and international trips, days out in all weathers, hundreds of hours of use for all sorts of listening from music to live sports events. They are beyond comfy for me, something I struggle with as my ears as so small but the smallest included tips are an excellent fit (the 2nd smallest tips also fit me which is a rarity among earbud tips).Recently purchased a 2nd pair in green, gorgeous gorgeous colour and just as high quality as my pink pair.",earbuds usei gifted pink pair years ago use time earbuds held several holidays international trips days weathers hundreds hours use sorts listening music live sports events beyond comfy something struggle ears small smallest included tips excellent fit 2nd smallest tips also fit rarity among earbud tipsrecently purchased 2nd pair green gorgeous gorgeous colour high quality pink pair,"['earbuds', 'usei', 'gifted', 'pink', 'pair', 'years', 'ago', 'use', 'time', 'earbuds', 'held', 'several', 'holidays', 'international', 'trips', 'days', 'weathers', 'hundreds', 'hours', 'use', 'sorts', 'listening', 'music', 'live', 'sports', 'events', 'beyond', 'comfy', 'something', 'struggle', 'ears', 'small', 'smallest', 'included', 'tips', 'excellent', 'fit', '2nd', 'smallest', 'tips', 'also', 'fit', 'rarity', 'among', 'earbud', 'tipsrecently', 'purchased', '2nd', 'pair', 'green', 'gorgeous', 'gorgeous', 'colour', 'high', 'quality', 'pink', 'pair']","[('earbuds', 'n'), ('usei', 'r'), ('gifted', 'v'), ('pink', 'a'), ('pair', 'n'), ('years', 'n'), ('ago', 'r'), ('use', 'v'), ('time', 'n'), ('earbuds', 'n'), ('held', 'v'), ('several', 'a'), ('holidays', 'n'), ('international', 'a'), ('trips', 'n'), ('days', 'n'), ('weathers', 'n'), ('hundreds', 'n'), ('hours', 'n'), ('use', 'v'), ('sorts', 'n'), ('listening', 'v'), ('music', 'n'), ('live', 'a'), ('sports', 'n'), ('events', 'n'), ('beyond', 'n'), ('comfy', 'n'), ('something', 'n'), ('struggle', 'a'), ('ears', 'n'), ('small', 'a'), ('smallest', 'a'), ('included', 'v'), ('tips', 'n'), ('excellent', 'a'), ('fit', 'a'), ('2nd', 'n'), ('smallest', 'a'), ('tips', 'n'), ('also', 'r'), ('fit', 'v'), ('rarity', 'n'), ('among', 'n'), ('earbud', 'a'), ('tipsrecently', 'r'), ('purchased', 'v'), ('2nd', 'n'), ('pair', 'n'), ('green', 'a'), ('gorgeous', 'a'), ('gorgeous', 'a'), ('colour', 'n'), ('high', 'a'), ('quality', 'n'), ('pink', 'v'), ('pair', 'n')]","['earbuds', 'usei', 'gift', 'pink', 'pair', 'year', 'ago', 'use', 'time', 'earbuds', 'hold', 'several', 'holiday', 'international', 'trip', 'day', 'weather', 'hundred', 'hour', 'use', 'sort', 'listen', 'music', 'live', 'sport', 'event', 'beyond', 'comfy', 'something', 'struggle', 'ear', 'small', 'small', 'include', 'tip', 'excellent', 'fit', '2nd', 'small', 'tip', 'also', 'fit', 'rarity', 'among', 'earbud', 'tipsrecently', 'purchase', '2nd', 'pair', 'green', 'gorgeous', 'gorgeous', 'colour', 'high', 'quality', 'pink', 'pair']",5,Positive,2
