,Title,Clean Title,Title Tokenized,Title Wordnet Pos,Title Lemmatized,Content,Clean Content,Text Tokenized,Text Wordnet Pos,Text Lemmatized,Rating,Sentiment,Target
29,9 month review,nine month review,"['nine', 'month', 'review']","[('nine', 'n'), ('month', 'n'), ('review', 'n')]","['nine', 'month', 'review']","I bought these in August 2021 after growing increasingly frustrated with traditional earphones. So far they have lasted longer than any traditional pair I have owed, but with some downsides. They occasionally fail to reach 100% charge, especially now as they only make it to 90%. They become confused when I wear only one at work, often repeating ""primary"" or ""pairing"" randomly while in use even though the other is switched off and secure in the box. They do cancel external sound rather well, but adjusting the volume manually with either piece has been difficult; I can never adjust the volume one bar at a time, instead a single attempt either drops the volume very low or very high and deafening, so I'm constantly using the phone to adjust instead. Answering calls has been fine and no microphone issues to report. They also have a tendency to migrate out of my ears after a while forcing me to readjust...not sure what that is about, maybe I have weird ears. The sound quality is a major fact",bought august two thousand and twenty-one growing increasingly frustrated traditional earphones far lasted longer traditional pair owed downsides occasionally fail reach one hundred charge especially make ninety become confused wear one work often repeating primary pairing randomly use even though switched secure box cancel external sound rather well adjusting volume manually either piece difficult never adjust volume one bar time instead single attempt either drops volume low high deafening constantly using phone adjust instead answering calls fine microphone issues report also tendency migrate ears forcing readjustnot sure maybe weird ears sound quality major fact,"['bought', 'august', 'two', 'thousand', 'and', 'twenty-one', 'growing', 'increasingly', 'frustrated', 'traditional', 'earphones', 'far', 'lasted', 'longer', 'traditional', 'pair', 'owed', 'downsides', 'occasionally', 'fail', 'reach', 'one', 'hundred', 'charge', 'especially', 'make', 'ninety', 'become', 'confused', 'wear', 'one', 'work', 'often', 'repeating', 'primary', 'pairing', 'randomly', 'use', 'even', 'though', 'switched', 'secure', 'box', 'cancel', 'external', 'sound', 'rather', 'well', 'adjusting', 'volume', 'manually', 'either', 'piece', 'difficult', 'never', 'adjust', 'volume', 'one', 'bar', 'time', 'instead', 'single', 'attempt', 'either', 'drops', 'volume', 'low', 'high', 'deafening', 'constantly', 'using', 'phone', 'adjust', 'instead', 'answering', 'calls', 'fine', 'microphone', 'issues', 'report', 'also', 'tendency', 'migrate', 'ears', 'forcing', 'readjustnot', 'sure', 'maybe', 'weird', 'ears', 'sound', 'quality', 'major', 'fact']","[('bought', 'v'), ('august', 'r'), ('two', 'n'), ('thousand', 'n'), ('and', 'n'), ('twenty-one', 'n'), ('growing', 'v'), ('increasingly', 'r'), ('frustrated', 'v'), ('traditional', 'a'), ('earphones', 'n'), ('far', 'r'), ('lasted', 'v'), ('longer', 'r'), ('traditional', 'a'), ('pair', 'n'), ('owed', 'v'), ('downsides', 'n'), ('occasionally', 'r'), ('fail', 'v'), ('reach', 'v'), ('one', 'n'), ('hundred', 'n'), ('charge', 'n'), ('especially', 'r'), ('make', 'v'), ('ninety', 'n'), ('become', 'n'), ('confused', 'v'), ('wear', 'a'), ('one', 'n'), ('work', 'n'), ('often', 'r'), ('repeating', 'v'), ('primary', 'a'), ('pairing', 'v'), ('randomly', 'n'), ('use', 'n'), ('even', 'r'), ('though', 'n'), ('switched', 'a'), ('secure', 'n'), ('box', 'n'), ('cancel', 'v'), ('external', 'a'), ('sound', 'n'), ('rather', 'r'), ('well', 'r'), ('adjusting', 'v'), ('volume', 'n'), ('manually', 'r'), ('either', 'n'), ('piece', 'r'), ('difficult', 'a'), ('never', 'r'), ('adjust', 'v'), ('volume', 'n'), ('one', 'n'), ('bar', 'n'), ('time', 'n'), ('instead', 'r'), ('single', 'a'), ('attempt', 'n'), ('either', 'n'), ('drops', 'a'), ('volume', 'n'), ('low', 'a'), ('high', 'a'), ('deafening', 'v'), ('constantly', 'r'), ('using', 'v'), ('phone', 'n'), ('adjust', 'n'), ('instead', 'r'), ('answering', 'v'), ('calls', 'n'), ('fine', 'a'), ('microphone', 'n'), ('issues', 'n'), ('report', 'n'), ('also', 'r'), ('tendency', 'a'), ('migrate', 'n'), ('ears', 'n'), ('forcing', 'v'), ('readjustnot', 'a'), ('sure', 'a'), ('maybe', 'r'), ('weird', 'a'), ('ears', 'n'), ('sound', 'v'), ('quality', 'a'), ('major', 'a'), ('fact', 'n')]","['buy', 'august', 'two', 'thousand', 'and', 'twenty-one', 'grow', 'increasingly', 'frustrate', 'traditional', 'earphone', 'far', 'last', 'longer', 'traditional', 'pair', 'owe', 'downside', 'occasionally', 'fail', 'reach', 'one', 'hundred', 'charge', 'especially', 'make', 'ninety', 'become', 'confuse', 'wear', 'one', 'work', 'often', 'repeat', 'primary', 'pair', 'randomly', 'use', 'even', 'though', 'switched', 'secure', 'box', 'cancel', 'external', 'sound', 'rather', 'well', 'adjust', 'volume', 'manually', 'either', 'piece', 'difficult', 'never', 'adjust', 'volume', 'one', 'bar', 'time', 'instead', 'single', 'attempt', 'either', 'drops', 'volume', 'low', 'high', 'deafen', 'constantly', 'use', 'phone', 'adjust', 'instead', 'answer', 'call', 'fine', 'microphone', 'issue', 'report', 'also', 'tendency', 'migrate', 'ear', 'force', 'readjustnot', 'sure', 'maybe', 'weird', 'ear', 'sound', 'quality', 'major', 'fact']",4,Positive,2
30,Excellent quality earphones. Although perhaps not the greatest for running.,excellent quality earphones although perhaps greatest running,"['excellent', 'quality', 'earphones', 'although', 'perhaps', 'greatest', 'running']","[('excellent', 'a'), ('quality', 'n'), ('earphones', 'n'), ('although', 'n'), ('perhaps', 'r'), ('greatest', 'a'), ('running', 'v')]","['excellent', 'quality', 'earphone', 'although', 'perhaps', 'great', 'run']","Ever since the release of Bluetooth earphones I have been an avid fan. Such devices, combined with a phone strap, have revolutionised my fitness as I often found that the old wire that got in the way was tedious. A year ago I purchased my first wireless Bluetooth earphones which lasted me a year because unfortunately the battery became unsustainable. Although they were a cheap pair for £20 that I got from a market while in Spain. Anyway, I loved them and always wore them at university. They were basically a cheap version of Apple's air pods. While searching for a new pair I decided this time that I would fork out a little more cash and decided to purchase the Tozo's.So far so good, it's everything it promised in the description and came nicely packaged. You are provided with four sizes of earphone rubber, which is reassuring if you have small ears like me and they fit snuggly. The sound quality is perfect and is synced with whatever image you're watching on screen. To my pleasure, I ca",ever since release bluetooth earphones avid fan devices combined phone strap revolutionised fitness often found old wire got way tedious year ago purchased first wireless bluetooth earphones lasted year unfortunately battery became unsustainable although cheap pair twenty got market spain anyway loved always wore university basically cheap version apples air pods searching new pair decided time would fork little cash decided purchase tozosso far good everything promised description came nicely packaged provided four sizes earphone rubber reassuring small ears like fit snuggly sound quality perfect synced whatever image watching screen pleasure ca,"['ever', 'since', 'release', 'bluetooth', 'earphones', 'avid', 'fan', 'devices', 'combined', 'phone', 'strap', 'revolutionised', 'fitness', 'often', 'found', 'old', 'wire', 'got', 'way', 'tedious', 'year', 'ago', 'purchased', 'first', 'wireless', 'bluetooth', 'earphones', 'lasted', 'year', 'unfortunately', 'battery', 'became', 'unsustainable', 'although', 'cheap', 'pair', 'twenty', 'got', 'market', 'spain', 'anyway', 'loved', 'always', 'wore', 'university', 'basically', 'cheap', 'version', 'apples', 'air', 'pods', 'searching', 'new', 'pair', 'decided', 'time', 'would', 'fork', 'little', 'cash', 'decided', 'purchase', 'tozosso', 'far', 'good', 'everything', 'promised', 'description', 'came', 'nicely', 'packaged', 'provided', 'four', 'sizes', 'earphone', 'rubber', 'reassuring', 'small', 'ears', 'like', 'fit', 'snuggly', 'sound', 'quality', 'perfect', 'synced', 'whatever', 'image', 'watching', 'screen', 'pleasure', 'ca']","[('ever', 'r'), ('since', 'n'), ('release', 'n'), ('bluetooth', 'n'), ('earphones', 'n'), ('avid', 'r'), ('fan', 'a'), ('devices', 'n'), ('combined', 'v'), ('phone', 'n'), ('strap', 'n'), ('revolutionised', 'v'), ('fitness', 'n'), ('often', 'r'), ('found', 'v'), ('old', 'a'), ('wire', 'n'), ('got', 'v'), ('way', 'n'), ('tedious', 'a'), ('year', 'n'), ('ago', 'r'), ('purchased', 'v'), ('first', 'a'), ('wireless', 'n'), ('bluetooth', 'n'), ('earphones', 'n'), ('lasted', 'v'), ('year', 'n'), ('unfortunately', 'r'), ('battery', 'n'), ('became', 'v'), ('unsustainable', 'a'), ('although', 'n'), ('cheap', 'a'), ('pair', 'n'), ('twenty', 'n'), ('got', 'v'), ('market', 'n'), ('spain', 'v'), ('anyway', 'r'), ('loved', 'a'), ('always', 'r'), ('wore', 'v'), ('university', 'n'), ('basically', 'r'), ('cheap', 'a'), ('version', 'n'), ('apples', 'n'), ('air', 'v'), ('pods', 'n'), ('searching', 'v'), ('new', 'a'), ('pair', 'n'), ('decided', 'v'), ('time', 'n'), ('would', 'n'), ('fork', 'v'), ('little', 'a'), ('cash', 'n'), ('decided', 'v'), ('purchase', 'n'), ('tozosso', 'n'), ('far', 'r'), ('good', 'a'), ('everything', 'n'), ('promised', 'v'), ('description', 'n'), ('came', 'v'), ('nicely', 'r'), ('packaged', 'v'), ('provided', 'v'), ('four', 'n'), ('sizes', 'n'), ('earphone', 'v'), ('rubber', 'n'), ('reassuring', 'v'), ('small', 'a'), ('ears', 'n'), ('like', 'n'), ('fit', 'a'), ('snuggly', 'r'), ('sound', 'a'), ('quality', 'n'), ('perfect', 'n'), ('synced', 'v'), ('whatever', 'n'), ('image', 'n'), ('watching', 'v'), ('screen', 'a'), ('pleasure', 'n'), ('ca', 'n')]","['ever', 'since', 'release', 'bluetooth', 'earphone', 'avid', 'fan', 'device', 'combine', 'phone', 'strap', 'revolutionise', 'fitness', 'often', 'find', 'old', 'wire', 'get', 'way', 'tedious', 'year', 'ago', 'purchase', 'first', 'wireless', 'bluetooth', 'earphone', 'last', 'year', 'unfortunately', 'battery', 'become', 'unsustainable', 'although', 'cheap', 'pair', 'twenty', 'get', 'market', 'spain', 'anyway', 'loved', 'always', 'wear', 'university', 'basically', 'cheap', 'version', 'apple', 'air', 'pod', 'search', 'new', 'pair', 'decide', 'time', 'would', 'fork', 'little', 'cash', 'decide', 'purchase', 'tozosso', 'far', 'good', 'everything', 'promise', 'description', 'come', 'nicely', 'package', 'provide', 'four', 'size', 'earphone', 'rubber', 'reassure', 'small', 'ear', 'like', 'fit', 'snuggly', 'sound', 'quality', 'perfect', 'sync', 'whatever', 'image', 'watch', 'screen', 'pleasure', 'ca']",4,Positive,2
31,Solid set of earbuds for a lower price,solid set earbuds lower price,"['solid', 'set', 'earbuds', 'lower', 'price']","[('solid', 'a'), ('set', 'n'), ('earbuds', 'n'), ('lower', 'a'), ('price', 'n')]","['solid', 'set', 'earbuds', 'low', 'price']","Had these for a few years now, overall a great pair of in-ear headphones. The battery life is excellent and the sound quality, particularly the bass, is impressive.Despite being dropped a fair few times, the charging case charges well with that consideration.The same goes for the buds. After regular use for a few years, the sound quality is remarkable. Little to no noise or distortion in the sound quality. That said, I experience some volume and quality loss in one bud. Again could be due to the fact they've been dropped a few times, said, I experience some volume and quality loss",years overall great pair inear headphones battery life excellent sound quality particularly bass impressivedespite dropped fair times charging case charges well considerationthe goes buds regular use years sound quality remarkable little noise distortion sound quality said experience volume quality loss one bud could due fact dropped times said experience volume quality loss,"['years', 'overall', 'great', 'pair', 'inear', 'headphones', 'battery', 'life', 'excellent', 'sound', 'quality', 'particularly', 'bass', 'impressivedespite', 'dropped', 'fair', 'times', 'charging', 'case', 'charges', 'well', 'considerationthe', 'goes', 'buds', 'regular', 'use', 'years', 'sound', 'quality', 'remarkable', 'little', 'noise', 'distortion', 'sound', 'quality', 'said', 'experience', 'volume', 'quality', 'loss', 'one', 'bud', 'could', 'due', 'fact', 'dropped', 'times', 'said', 'experience', 'volume', 'quality', 'loss']","[('years', 'n'), ('overall', 'a'), ('great', 'a'), ('pair', 'n'), ('inear', 'a'), ('headphones', 'n'), ('battery', 'n'), ('life', 'n'), ('excellent', 'a'), ('sound', 'a'), ('quality', 'n'), ('particularly', 'r'), ('bass', 'n'), ('impressivedespite', 'n'), ('dropped', 'v'), ('fair', 'a'), ('times', 'n'), ('charging', 'v'), ('case', 'n'), ('charges', 'n'), ('well', 'r'), ('considerationthe', 'r'), ('goes', 'v'), ('buds', 'n'), ('regular', 'a'), ('use', 'n'), ('years', 'n'), ('sound', 'v'), ('quality', 'n'), ('remarkable', 'a'), ('little', 'a'), ('noise', 'a'), ('distortion', 'n'), ('sound', 'n'), ('quality', 'n'), ('said', 'v'), ('experience', 'n'), ('volume', 'n'), ('quality', 'n'), ('loss', 'n'), ('one', 'n'), ('bud', 'n'), ('could', 'n'), ('due', 'v'), ('fact', 'n'), ('dropped', 'v'), ('times', 'n'), ('said', 'v'), ('experience', 'n'), ('volume', 'n'), ('quality', 'n'), ('loss', 'n')]","['year', 'overall', 'great', 'pair', 'inear', 'headphone', 'battery', 'life', 'excellent', 'sound', 'quality', 'particularly', 'bass', 'impressivedespite', 'drop', 'fair', 'time', 'charge', 'case', 'charge', 'well', 'considerationthe', 'go', 'bud', 'regular', 'use', 'year', 'sound', 'quality', 'remarkable', 'little', 'noise', 'distortion', 'sound', 'quality', 'say', 'experience', 'volume', 'quality', 'loss', 'one', 'bud', 'could', 'due', 'fact', 'drop', 'time', 'say', 'experience', 'volume', 'quality', 'loss']",4,Positive,2
32,Fantastic value for money,fantastic value money,"['fantastic', 'value', 'money']","[('fantastic', 'a'), ('value', 'n'), ('money', 'n')]","['fantastic', 'value', 'money']","After buying the cambridge audio buds that only the right bud worked, returned them and ordered a replacement of the same, these worked fo z couple of days, then just refused to charge at all, then ordered the oppo buds and again onlly one earbud worked so sent them back and bought the Tozo T6 earbuds and they are fantastic and both buds charged and the sound quality and design are very good especially for the cost.WISH I HAD BOUGHT THESE FIRST.",buying cambridge audio buds right bud worked returned ordered replacement worked fo z couple days refused charge ordered oppo buds onlly one earbud worked sent back bought tozo t6 earbuds fantastic buds charged sound quality design good especially costwish bought first,"['buying', 'cambridge', 'audio', 'buds', 'right', 'bud', 'worked', 'returned', 'ordered', 'replacement', 'worked', 'fo', 'z', 'couple', 'days', 'refused', 'charge', 'ordered', 'oppo', 'buds', 'onlly', 'one', 'earbud', 'worked', 'sent', 'back', 'bought', 'tozo', 't6', 'earbuds', 'fantastic', 'buds', 'charged', 'sound', 'quality', 'design', 'good', 'especially', 'costwish', 'bought', 'first']","[('buying', 'n'), ('cambridge', 'n'), ('audio', 'n'), ('buds', 'n'), ('right', 'r'), ('bud', 'n'), ('worked', 'v'), ('returned', 'v'), ('ordered', 'a'), ('replacement', 'n'), ('worked', 'v'), ('fo', 'a'), ('z', 'a'), ('couple', 'n'), ('days', 'n'), ('refused', 'v'), ('charge', 'n'), ('ordered', 'v'), ('oppo', 'a'), ('buds', 'n'), ('onlly', 'r'), ('one', 'n'), ('earbud', 'n'), ('worked', 'v'), ('sent', 'v'), ('back', 'r'), ('bought', 'v'), ('tozo', 'n'), ('t6', 'n'), ('earbuds', 'v'), ('fantastic', 'a'), ('buds', 'n'), ('charged', 'v'), ('sound', 'a'), ('quality', 'n'), ('design', 'n'), ('good', 'a'), ('especially', 'r'), ('costwish', 'a'), ('bought', 'v'), ('first', 'r')]","['buying', 'cambridge', 'audio', 'bud', 'right', 'bud', 'work', 'return', 'ordered', 'replacement', 'work', 'fo', 'z', 'couple', 'day', 'refuse', 'charge', 'order', 'oppo', 'bud', 'onlly', 'one', 'earbud', 'work', 'send', 'back', 'buy', 'tozo', 't6', 'earbuds', 'fantastic', 'bud', 'charge', 'sound', 'quality', 'design', 'good', 'especially', 'costwish', 'buy', 'first']",4,Positive,2
33,"Great, affordable pair of earbuds.",great affordable pair earbuds,"['great', 'affordable', 'pair', 'earbuds']","[('great', 'a'), ('affordable', 'a'), ('pair', 'n'), ('earbuds', 'n')]","['great', 'affordable', 'pair', 'earbuds']","Ordered these little gems after spending a bit of time reviewing an affordable set of earphones. Initially, I looked at a more expensive pair of JBL's, but I only really wanted these for walking the dog locally.So the verdict then? Well, in a word, Fantastic.The Good:Case- Nice weight to the case, but clearly designed to be portable.- Rubber, well fitting charging port cover. Nice touch.- 4 indication lights on the case to keep an eye on charge.- Magnetic case. This ensures that the lid closes nicely, and allows the buds to sit nicely within the case, and has a premium feel to it.Buds- Firstly, spoiled for choice when it comes to spare ear fittings, ranging from very small to extra large. I'd imagine that most people will find a comfortable fit. The default worked perfectly fine for me as it happens.- They sound perfectly fine for what I need. The bass isn't excessive, but there's clearly enough of it, without it sounding artificial.- There's very little sound leakage when they're in t",ordered little gems spending bit time reviewing affordable set earphones initially looked expensive pair jbls really wanted walking dog locallyso verdict well word fantasticthe goodcase nice weight case clearly designed portable rubber well fitting charging port cover nice touch four indication lights case keep eye charge magnetic case ensures lid closes nicely allows buds sit nicely within case premium feel itbuds firstly spoiled choice comes spare ear fittings ranging small extra large would imagine people find comfortable fit default worked perfectly fine happens sound perfectly fine need bass excessive clearly enough without sounding artificial little sound leakage,"['ordered', 'little', 'gems', 'spending', 'bit', 'time', 'reviewing', 'affordable', 'set', 'earphones', 'initially', 'looked', 'expensive', 'pair', 'jbls', 'really', 'wanted', 'walking', 'dog', 'locallyso', 'verdict', 'well', 'word', 'fantasticthe', 'goodcase', 'nice', 'weight', 'case', 'clearly', 'designed', 'portable', 'rubber', 'well', 'fitting', 'charging', 'port', 'cover', 'nice', 'touch', 'four', 'indication', 'lights', 'case', 'keep', 'eye', 'charge', 'magnetic', 'case', 'ensures', 'lid', 'closes', 'nicely', 'allows', 'buds', 'sit', 'nicely', 'within', 'case', 'premium', 'feel', 'itbuds', 'firstly', 'spoiled', 'choice', 'comes', 'spare', 'ear', 'fittings', 'ranging', 'small', 'extra', 'large', 'would', 'imagine', 'people', 'find', 'comfortable', 'fit', 'default', 'worked', 'perfectly', 'fine', 'happens', 'sound', 'perfectly', 'fine', 'need', 'bass', 'excessive', 'clearly', 'enough', 'without', 'sounding', 'artificial', 'little', 'sound', 'leakage']","[('ordered', 'v'), ('little', 'a'), ('gems', 'n'), ('spending', 'v'), ('bit', 'n'), ('time', 'n'), ('reviewing', 'v'), ('affordable', 'a'), ('set', 'v'), ('earphones', 'n'), ('initially', 'r'), ('looked', 'v'), ('expensive', 'a'), ('pair', 'n'), ('jbls', 'n'), ('really', 'r'), ('wanted', 'v'), ('walking', 'v'), ('dog', 'n'), ('locallyso', 'n'), ('verdict', 'n'), ('well', 'r'), ('word', 'n'), ('fantasticthe', 'n'), ('goodcase', 'n'), ('nice', 'a'), ('weight', 'n'), ('case', 'n'), ('clearly', 'r'), ('designed', 'v'), ('portable', 'a'), ('rubber', 'n'), ('well', 'r'), ('fitting', 'v'), ('charging', 'v'), ('port', 'n'), ('cover', 'n'), ('nice', 'r'), ('touch', 'r'), ('four', 'n'), ('indication', 'n'), ('lights', 'n'), ('case', 'n'), ('keep', 'v'), ('eye', 'n'), ('charge', 'n'), ('magnetic', 'a'), ('case', 'n'), ('ensures', 'v'), ('lid', 'a'), ('closes', 'n'), ('nicely', 'r'), ('allows', 'v'), ('buds', 'n'), ('sit', 'n'), ('nicely', 'r'), ('within', 'n'), ('case', 'n'), ('premium', 'n'), ('feel', 'n'), ('itbuds', 'r'), ('firstly', 'r'), ('spoiled', 'v'), ('choice', 'n'), ('comes', 'v'), ('spare', 'a'), ('ear', 'a'), ('fittings', 'n'), ('ranging', 'v'), ('small', 'a'), ('extra', 'a'), ('large', 'a'), ('would', 'n'), ('imagine', 'v'), ('people', 'n'), ('find', 'v'), ('comfortable', 'a'), ('fit', 'a'), ('default', 'n'), ('worked', 'v'), ('perfectly', 'r'), ('fine', 'a'), ('happens', 'n'), ('sound', 'v'), ('perfectly', 'r'), ('fine', 'a'), ('need', 'v'), ('bass', 'n'), ('excessive', 'a'), ('clearly', 'r'), ('enough', 'r'), ('without', 'n'), ('sounding', 'v'), ('artificial', 'a'), ('little', 'a'), ('sound', 'a'), ('leakage', 'n')]","['order', 'little', 'gem', 'spend', 'bit', 'time', 'review', 'affordable', 'set', 'earphone', 'initially', 'look', 'expensive', 'pair', 'jbls', 'really', 'want', 'walk', 'dog', 'locallyso', 'verdict', 'well', 'word', 'fantasticthe', 'goodcase', 'nice', 'weight', 'case', 'clearly', 'design', 'portable', 'rubber', 'well', 'fit', 'charge', 'port', 'cover', 'nice', 'touch', 'four', 'indication', 'light', 'case', 'keep', 'eye', 'charge', 'magnetic', 'case', 'ensure', 'lid', 'close', 'nicely', 'allow', 'bud', 'sit', 'nicely', 'within', 'case', 'premium', 'feel', 'itbuds', 'firstly', 'spoil', 'choice', 'come', 'spare', 'ear', 'fitting', 'range', 'small', 'extra', 'large', 'would', 'imagine', 'people', 'find', 'comfortable', 'fit', 'default', 'work', 'perfectly', 'fine', 'happens', 'sound', 'perfectly', 'fine', 'need', 'bass', 'excessive', 'clearly', 'enough', 'without', 'sound', 'artificial', 'little', 'sound', 'leakage']",5,Positive,2
