,Title,Clean Title,Title Tokenized,Title Wordnet Pos,Title Lemmatized,Content,Clean Content,Text Tokenized,Text Wordnet Pos,Text Lemmatized,Rating,Sentiment,Target
50,"Easy to use, comfortable good value",easy use comfortable good value,"['easy', 'use', 'comfortable', 'good', 'value']","[('easy', 'a'), ('use', 'n'), ('comfortable', 'a'), ('good', 'a'), ('value', 'n')]","['easy', 'use', 'comfortable', 'good', 'value']","Saw these and ordered the black ones. Arrived on time the next day. Packaging small and well thought out found the ear plugs laid out on opening and the (station) case, with spare earplugs in a separate container underneath, the lead for charging. Came charged and ready to go. I put the ear plugs in their case and they automatically paired with themselves. Instructions were easy to follow. Paired with my iPhone 11 very quickly. Easy to control for volume, pause and changing tracks. These are easy to use I have small fingers but the plugs seem to sit nicely in the ear so if you have large fingers I can’t see them being an issue when using the functionality of each plug. Sound quality for the money is not bad nor is the noise cancelling. I’ve only just got them so can’t comment on the length of charge or comfort of wearing buds for a long time periods. Very impressed.",saw ordered black ones arrived time next day packaging small well thought found ear plugs laid opening station case spare earplugs separate container underneath lead charging came charged ready go put ear plugs case automatically paired instructions easy follow paired iphone eleven quickly easy control volume pause changing tracks easy use small fingers plugs seem sit nicely ear large fingers cannot see issue using functionality plug sound quality money bad noise cancelling got cannot comment length charge comfort wearing buds long time periods impressed,"['saw', 'ordered', 'black', 'ones', 'arrived', 'time', 'next', 'day', 'packaging', 'small', 'well', 'thought', 'found', 'ear', 'plugs', 'laid', 'opening', 'station', 'case', 'spare', 'earplugs', 'separate', 'container', 'underneath', 'lead', 'charging', 'came', 'charged', 'ready', 'go', 'put', 'ear', 'plugs', 'case', 'automatically', 'paired', 'instructions', 'easy', 'follow', 'paired', 'iphone', 'eleven', 'quickly', 'easy', 'control', 'volume', 'pause', 'changing', 'tracks', 'easy', 'use', 'small', 'fingers', 'plugs', 'seem', 'sit', 'nicely', 'ear', 'large', 'fingers', 'can', 'not', 'see', 'issue', 'using', 'functionality', 'plug', 'sound', 'quality', 'money', 'bad', 'noise', 'cancelling', 'got', 'can', 'not', 'comment', 'length', 'charge', 'comfort', 'wearing', 'buds', 'long', 'time', 'periods', 'impressed']","[('saw', 'n'), ('ordered', 'v'), ('black', 'a'), ('ones', 'n'), ('arrived', 'v'), ('time', 'n'), ('next', 'a'), ('day', 'n'), ('packaging', 'v'), ('small', 'a'), ('well', 'r'), ('thought', 'v'), ('found', 'v'), ('ear', 'n'), ('plugs', 'n'), ('laid', 'v'), ('opening', 'v'), ('station', 'n'), ('case', 'n'), ('spare', 'a'), ('earplugs', 'n'), ('separate', 'a'), ('container', 'n'), ('underneath', 'a'), ('lead', 'a'), ('charging', 'n'), ('came', 'v'), ('charged', 'v'), ('ready', 'a'), ('go', 'v'), ('put', 'a'), ('ear', 'r'), ('plugs', 'a'), ('case', 'n'), ('automatically', 'r'), ('paired', 'v'), ('instructions', 'n'), ('easy', 'a'), ('follow', 'v'), ('paired', 'v'), ('iphone', 'n'), ('eleven', 'r'), ('quickly', 'r'), ('easy', 'a'), ('control', 'n'), ('volume', 'n'), ('pause', 'n'), ('changing', 'v'), ('tracks', 'n'), ('easy', 'a'), ('use', 'n'), ('small', 'a'), ('fingers', 'n'), ('plugs', 'v'), ('seem', 'v'), ('sit', 'n'), ('nicely', 'r'), ('ear', 'a'), ('large', 'a'), ('fingers', 'n'), ('can', 'n'), ('not', 'r'), ('see', 'v'), ('issue', 'n'), ('using', 'v'), ('functionality', 'n'), ('plug', 'n'), ('sound', 'n'), ('quality', 'n'), ('money', 'n'), ('bad', 'a'), ('noise', 'n'), ('cancelling', 'v'), ('got', 'v'), ('can', 'n'), ('not', 'r'), ('comment', 'v'), ('length', 'r'), ('charge', 'n'), ('comfort', 'n'), ('wearing', 'v'), ('buds', 'n'), ('long', 'a'), ('time', 'n'), ('periods', 'n'), ('impressed', 'v')]","['saw', 'order', 'black', 'one', 'arrive', 'time', 'next', 'day', 'package', 'small', 'well', 'think', 'find', 'ear', 'plug', 'lay', 'open', 'station', 'case', 'spare', 'earplug', 'separate', 'container', 'underneath', 'lead', 'charging', 'come', 'charge', 'ready', 'go', 'put', 'ear', 'plugs', 'case', 'automatically', 'pair', 'instruction', 'easy', 'follow', 'pair', 'iphone', 'eleven', 'quickly', 'easy', 'control', 'volume', 'pause', 'change', 'track', 'easy', 'use', 'small', 'finger', 'plug', 'seem', 'sit', 'nicely', 'ear', 'large', 'finger', 'can', 'not', 'see', 'issue', 'use', 'functionality', 'plug', 'sound', 'quality', 'money', 'bad', 'noise', 'cancel', 'get', 'can', 'not', 'comment', 'length', 'charge', 'comfort', 'wear', 'bud', 'long', 'time', 'period', 'impress']",4,Positive,2
51,Amazing,amazing,['amazing'],"[('amazing', 'v')]",['amaze'],Had these for a about a year now nNot had any problemsBattery life lasts for agesPerfect alternative for expensive earphones,year nnot problemsbattery life lasts agesperfect alternative expensive earphones,"['year', 'nnot', 'problemsbattery', 'life', 'lasts', 'agesperfect', 'alternative', 'expensive', 'earphones']","[('year', 'n'), ('nnot', 'n'), ('problemsbattery', 'n'), ('life', 'n'), ('lasts', 'n'), ('agesperfect', 'v'), ('alternative', 'a'), ('expensive', 'a'), ('earphones', 'n')]","['year', 'nnot', 'problemsbattery', 'life', 'last', 'agesperfect', 'alternative', 'expensive', 'earphone']",4,Positive,2
52,Tozo T6 Waterproof Wireless Earbuds - Superb!,tozo t6 waterproof wireless earbuds superb,"['tozo', 't6', 'waterproof', 'wireless', 'earbuds', 'superb']","[('tozo', 'n'), ('t6', 'n'), ('waterproof', 'n'), ('wireless', 'n'), ('earbuds', 'v'), ('superb', 'n')]","['tozo', 't6', 'waterproof', 'wireless', 'earbuds', 'superb']","This Tozo T6 waterproof wireless earbud set is easily the best I’ve tried. It paired straight out of the box with my iPhone 8 and played beautifully from my iTunes records.Once I found the right rubber covers for my ears there was no problem. I do treadmill running and found no problem keeping them in. I watch catchup tv on my phone and the sound quality absorbed me into the programme and away from the strenuous regime... thanks Tozo!Price is great... I’m glad I didn’t go for anything less and be disappointed ...again!!! Sweaty face or hands don’t affect the operation not performance - the buds stay put and my fingers don’t slip if I’m handing calls or reversing or forwarding tracks. I love the little voice telling you what you’ve done so you know you haven’t pressed wrong.My only niggle is sometimes when touching for the ‘Pause’ function there’s a very slight delay before the music stops which meant I touched it again ... starting the play... of course, after a couple of goes I got th",tozo t6 waterproof wireless earbud set easily best tried paired straight box iphone eight played beautifully itunes recordsonce found right rubber covers ears problem treadmill running found problem keeping watch catchup tv phone sound quality absorbed programme away strenuous regime thanks tozoprice great glad go anything less disappointed sweaty face hands affect operation performance buds stay put fingers slip handing calls reversing forwarding tracks love little voice telling done know pressed wrongmy niggle sometimes touching pause function slight delay music stops meant touched starting play course couple goes got th,"['tozo', 't6', 'waterproof', 'wireless', 'earbud', 'set', 'easily', 'best', 'tried', 'paired', 'straight', 'box', 'iphone', 'eight', 'played', 'beautifully', 'itunes', 'recordsonce', 'found', 'right', 'rubber', 'covers', 'ears', 'problem', 'treadmill', 'running', 'found', 'problem', 'keeping', 'watch', 'catchup', 'tv', 'phone', 'sound', 'quality', 'absorbed', 'programme', 'away', 'strenuous', 'regime', 'thanks', 'tozoprice', 'great', 'glad', 'go', 'anything', 'less', 'disappointed', 'sweaty', 'face', 'hands', 'affect', 'operation', 'performance', 'buds', 'stay', 'put', 'fingers', 'slip', 'handing', 'calls', 'reversing', 'forwarding', 'tracks', 'love', 'little', 'voice', 'telling', 'done', 'know', 'pressed', 'wrongmy', 'niggle', 'sometimes', 'touching', 'pause', 'function', 'slight', 'delay', 'music', 'stops', 'meant', 'touched', 'starting', 'play', 'course', 'couple', 'goes', 'got', 'th']","[('tozo', 'n'), ('t6', 'n'), ('waterproof', 'n'), ('wireless', 'n'), ('earbud', 'n'), ('set', 'v'), ('easily', 'r'), ('best', 'a'), ('tried', 'a'), ('paired', 'a'), ('straight', 'n'), ('box', 'n'), ('iphone', 'n'), ('eight', 'n'), ('played', 'v'), ('beautifully', 'r'), ('itunes', 'a'), ('recordsonce', 'n'), ('found', 'v'), ('right', 'a'), ('rubber', 'n'), ('covers', 'v'), ('ears', 'n'), ('problem', 'n'), ('treadmill', 'n'), ('running', 'v'), ('found', 'v'), ('problem', 'n'), ('keeping', 'v'), ('watch', 'n'), ('catchup', 'n'), ('tv', 'n'), ('phone', 'n'), ('sound', 'n'), ('quality', 'n'), ('absorbed', 'v'), ('programme', 'v'), ('away', 'r'), ('strenuous', 'a'), ('regime', 'a'), ('thanks', 'n'), ('tozoprice', 'r'), ('great', 'a'), ('glad', 'a'), ('go', 'v'), ('anything', 'n'), ('less', 'r'), ('disappointed', 'a'), ('sweaty', 'n'), ('face', 'n'), ('hands', 'n'), ('affect', 'a'), ('operation', 'n'), ('performance', 'n'), ('buds', 'n'), ('stay', 'n'), ('put', 'v'), ('fingers', 'n'), ('slip', 'v'), ('handing', 'v'), ('calls', 'n'), ('reversing', 'v'), ('forwarding', 'v'), ('tracks', 'n'), ('love', 'v'), ('little', 'a'), ('voice', 'n'), ('telling', 'v'), ('done', 'v'), ('know', 'v'), ('pressed', 'v'), ('wrongmy', 'a'), ('niggle', 'n'), ('sometimes', 'r'), ('touching', 'v'), ('pause', 'n'), ('function', 'n'), ('slight', 'v'), ('delay', 'n'), ('music', 'n'), ('stops', 'v'), ('meant', 'v'), ('touched', 'v'), ('starting', 'v'), ('play', 'n'), ('course', 'n'), ('couple', 'n'), ('goes', 'v'), ('got', 'v'), ('th', 'n')]","['tozo', 't6', 'waterproof', 'wireless', 'earbud', 'set', 'easily', 'best', 'tried', 'paired', 'straight', 'box', 'iphone', 'eight', 'play', 'beautifully', 'itunes', 'recordsonce', 'find', 'right', 'rubber', 'cover', 'ear', 'problem', 'treadmill', 'run', 'find', 'problem', 'keep', 'watch', 'catchup', 'tv', 'phone', 'sound', 'quality', 'absorb', 'programme', 'away', 'strenuous', 'regime', 'thanks', 'tozoprice', 'great', 'glad', 'go', 'anything', 'less', 'disappointed', 'sweaty', 'face', 'hand', 'affect', 'operation', 'performance', 'bud', 'stay', 'put', 'finger', 'slip', 'hand', 'call', 'reverse', 'forward', 'track', 'love', 'little', 'voice', 'tell', 'do', 'know', 'press', 'wrongmy', 'niggle', 'sometimes', 'touch', 'pause', 'function', 'slight', 'delay', 'music', 'stop', 'mean', 'touch', 'start', 'play', 'course', 'couple', 'go', 'get', 'th']",4,Positive,2
53,"Resilient, great",resilient great,"['resilient', 'great']","[('resilient', 'a'), ('great', 'a')]","['resilient', 'great']","These are still going strong after a year and a half of constant use. They went through the wash and still work. Amazing battery life, can't fault them",still going strong year half constant use went wash still work amazing battery life cannot fault,"['still', 'going', 'strong', 'year', 'half', 'constant', 'use', 'went', 'wash', 'still', 'work', 'amazing', 'battery', 'life', 'can', 'not', 'fault']","[('still', 'r'), ('going', 'v'), ('strong', 'a'), ('year', 'n'), ('half', 'n'), ('constant', 'a'), ('use', 'n'), ('went', 'v'), ('wash', 'n'), ('still', 'r'), ('work', 'v'), ('amazing', 'a'), ('battery', 'n'), ('life', 'n'), ('can', 'n'), ('not', 'r'), ('fault', 'v')]","['still', 'go', 'strong', 'year', 'half', 'constant', 'use', 'go', 'wash', 'still', 'work', 'amazing', 'battery', 'life', 'can', 'not', 'fault']",5,Positive,2
54,Great quality product at this price point,great quality product price point,"['great', 'quality', 'product', 'price', 'point']","[('great', 'a'), ('quality', 'n'), ('product', 'n'), ('price', 'n'), ('point', 'n')]","['great', 'quality', 'product', 'price', 'point']","The presentation of these ear buds is something that would leave Tim Cook sweaty and breathing heavily.They come nicely packaged with 3 additional sets of rubber insert thingies and a micro-USB cable in very smart packaging.They feel robust and of high quality. They don't have the cheap plastic feel of other headphones I've owned. The charging case is a convenient size and easy to open. It closes with a satisfying click, and the ear buds also slip into their magnetised housing nicely. Battery indicators on the outside of the case are welcome, as is the wireless charging capability for those of us too lazy to simple plug it in!Pairing is easy; I placed mine into the charging box, removed them again and they popped up on my phone.I tried a couple of different sized rubber thingies to find the right fit; I can shake my head aggressively (as one does) without the ear buds moving at all. They don't feel like they're going to fall out despite the lack of over-ear support but I don't foresee ",presentation ear buds something would leave tim cook sweaty breathing heavilythey come nicely packaged three additional sets rubber insert thingies microusb cable smart packagingthey feel robust high quality cheap plastic feel headphones owned charging case convenient size easy open closes satisfying click ear buds also slip magnetised housing nicely battery indicators outside case welcome wireless charging capability us lazy simple plug inpairing easy placed mine charging box removed popped phonei tried couple different sized rubber thingies find right fit shake head aggressively one without ear buds moving feel like going fall despite lack overear support foresee,"['presentation', 'ear', 'buds', 'something', 'would', 'leave', 'tim', 'cook', 'sweaty', 'breathing', 'heavilythey', 'come', 'nicely', 'packaged', 'three', 'additional', 'sets', 'rubber', 'insert', 'thingies', 'microusb', 'cable', 'smart', 'packagingthey', 'feel', 'robust', 'high', 'quality', 'cheap', 'plastic', 'feel', 'headphones', 'owned', 'charging', 'case', 'convenient', 'size', 'easy', 'open', 'closes', 'satisfying', 'click', 'ear', 'buds', 'also', 'slip', 'magnetised', 'housing', 'nicely', 'battery', 'indicators', 'outside', 'case', 'welcome', 'wireless', 'charging', 'capability', 'us', 'lazy', 'simple', 'plug', 'inpairing', 'easy', 'placed', 'mine', 'charging', 'box', 'removed', 'popped', 'phonei', 'tried', 'couple', 'different', 'sized', 'rubber', 'thingies', 'find', 'right', 'fit', 'shake', 'head', 'aggressively', 'one', 'without', 'ear', 'buds', 'moving', 'feel', 'like', 'going', 'fall', 'despite', 'lack', 'overear', 'support', 'foresee']","[('presentation', 'n'), ('ear', 'n'), ('buds', 'n'), ('something', 'n'), ('would', 'n'), ('leave', 'v'), ('tim', 'n'), ('cook', 'n'), ('sweaty', 'n'), ('breathing', 'v'), ('heavilythey', 'a'), ('come', 'v'), ('nicely', 'r'), ('packaged', 'v'), ('three', 'n'), ('additional', 'a'), ('sets', 'n'), ('rubber', 'v'), ('insert', 'a'), ('thingies', 'n'), ('microusb', 'v'), ('cable', 'n'), ('smart', 'n'), ('packagingthey', 'n'), ('feel', 'v'), ('robust', 'a'), ('high', 'a'), ('quality', 'n'), ('cheap', 'v'), ('plastic', 'n'), ('feel', 'n'), ('headphones', 'n'), ('owned', 'v'), ('charging', 'v'), ('case', 'n'), ('convenient', 'a'), ('size', 'n'), ('easy', 'a'), ('open', 'a'), ('closes', 'n'), ('satisfying', 'v'), ('click', 'a'), ('ear', 'n'), ('buds', 'n'), ('also', 'r'), ('slip', 'n'), ('magnetised', 'v'), ('housing', 'n'), ('nicely', 'r'), ('battery', 'a'), ('indicators', 'n'), ('outside', 'n'), ('case', 'n'), ('welcome', 'a'), ('wireless', 'n'), ('charging', 'v'), ('capability', 'n'), ('us', 'n'), ('lazy', 'a'), ('simple', 'a'), ('plug', 'n'), ('inpairing', 'v'), ('easy', 'a'), ('placed', 'v'), ('mine', 'n'), ('charging', 'v'), ('box', 'n'), ('removed', 'v'), ('popped', 'a'), ('phonei', 'n'), ('tried', 'a'), ('couple', 'n'), ('different', 'a'), ('sized', 'a'), ('rubber', 'n'), ('thingies', 'n'), ('find', 'v'), ('right', 'a'), ('fit', 'n'), ('shake', 'v'), ('head', 'n'), ('aggressively', 'r'), ('one', 'n'), ('without', 'n'), ('ear', 'n'), ('buds', 'n'), ('moving', 'v'), ('feel', 'n'), ('like', 'n'), ('going', 'v'), ('fall', 'n'), ('despite', 'n'), ('lack', 'n'), ('overear', 'a'), ('support', 'n'), ('foresee', 'n')]","['presentation', 'ear', 'bud', 'something', 'would', 'leave', 'tim', 'cook', 'sweaty', 'breathe', 'heavilythey', 'come', 'nicely', 'package', 'three', 'additional', 'set', 'rubber', 'insert', 'thingies', 'microusb', 'cable', 'smart', 'packagingthey', 'feel', 'robust', 'high', 'quality', 'cheap', 'plastic', 'feel', 'headphone', 'own', 'charge', 'case', 'convenient', 'size', 'easy', 'open', 'close', 'satisfy', 'click', 'ear', 'bud', 'also', 'slip', 'magnetise', 'housing', 'nicely', 'battery', 'indicator', 'outside', 'case', 'welcome', 'wireless', 'charge', 'capability', 'u', 'lazy', 'simple', 'plug', 'inpairing', 'easy', 'place', 'mine', 'charge', 'box', 'remove', 'popped', 'phonei', 'tried', 'couple', 'different', 'sized', 'rubber', 'thingies', 'find', 'right', 'fit', 'shake', 'head', 'aggressively', 'one', 'without', 'ear', 'bud', 'move', 'feel', 'like', 'go', 'fall', 'despite', 'lack', 'overear', 'support', 'foresee']",5,Positive,2
55,Fantastic value for money,fantastic value money,"['fantastic', 'value', 'money']","[('fantastic', 'a'), ('value', 'n'), ('money', 'n')]","['fantastic', 'value', 'money']","For the money, these headphones are the best purchase I've ever made. The sound quality is not going to be the best audio quality out there - but for the price, it's amazingly good. The touch controls can be a little tricky to get used to, but its still a nice feature to have. The passive noise cancellation is also surprisingly good.The headphones are easy to use and easy to pair. Whilst audiophiles may not appreciate the audio quality, I think most people will be perfectly happy with it - especially at this price point. The value for money is amazingThey charge wirelessly. There are a few different tip sizes to choose for the earbuds, and they've never fallen out of my ears.Most important is the customer service. I contacted the support team as I had an issue. They were incredibly helpful, replied very quickly and were very accommodating - most customer service teams seem to ignore you these days.Given the budget price of these headphones, I would (and have done) recommend these to an",money headphones best purchase ever made sound quality going best audio quality price amazingly good touch controls little tricky get used still nice feature passive noise cancellation also surprisingly goodthe headphones easy use easy pair whilst audiophiles may appreciate audio quality think people perfectly happy especially price point value money amazingthey charge wirelessly different tip sizes choose earbuds never fallen earsmost important customer service contacted support team issue incredibly helpful replied quickly accommodating customer service teams seem ignore daysgiven budget price headphones would done recommend,"['money', 'headphones', 'best', 'purchase', 'ever', 'made', 'sound', 'quality', 'going', 'best', 'audio', 'quality', 'price', 'amazingly', 'good', 'touch', 'controls', 'little', 'tricky', 'get', 'used', 'still', 'nice', 'feature', 'passive', 'noise', 'cancellation', 'also', 'surprisingly', 'goodthe', 'headphones', 'easy', 'use', 'easy', 'pair', 'whilst', 'audiophiles', 'may', 'appreciate', 'audio', 'quality', 'think', 'people', 'perfectly', 'happy', 'especially', 'price', 'point', 'value', 'money', 'amazingthey', 'charge', 'wirelessly', 'different', 'tip', 'sizes', 'choose', 'earbuds', 'never', 'fallen', 'earsmost', 'important', 'customer', 'service', 'contacted', 'support', 'team', 'issue', 'incredibly', 'helpful', 'replied', 'quickly', 'accommodating', 'customer', 'service', 'teams', 'seem', 'ignore', 'daysgiven', 'budget', 'price', 'headphones', 'would', 'done', 'recommend']","[('money', 'n'), ('headphones', 'n'), ('best', 'r'), ('purchase', 'n'), ('ever', 'r'), ('made', 'v'), ('sound', 'a'), ('quality', 'n'), ('going', 'v'), ('best', 'a'), ('audio', 'a'), ('quality', 'n'), ('price', 'n'), ('amazingly', 'r'), ('good', 'a'), ('touch', 'n'), ('controls', 'n'), ('little', 'a'), ('tricky', 'a'), ('get', 'n'), ('used', 'v'), ('still', 'r'), ('nice', 'a'), ('feature', 'n'), ('passive', 'a'), ('noise', 'n'), ('cancellation', 'n'), ('also', 'r'), ('surprisingly', 'r'), ('goodthe', 'a'), ('headphones', 'n'), ('easy', 'a'), ('use', 'n'), ('easy', 'a'), ('pair', 'n'), ('whilst', 'n'), ('audiophiles', 'n'), ('may', 'n'), ('appreciate', 'v'), ('audio', 'a'), ('quality', 'n'), ('think', 'v'), ('people', 'n'), ('perfectly', 'r'), ('happy', 'a'), ('especially', 'r'), ('price', 'n'), ('point', 'n'), ('value', 'n'), ('money', 'n'), ('amazingthey', 'n'), ('charge', 'n'), ('wirelessly', 'r'), ('different', 'a'), ('tip', 'n'), ('sizes', 'n'), ('choose', 'v'), ('earbuds', 'a'), ('never', 'r'), ('fallen', 'v'), ('earsmost', 'r'), ('important', 'a'), ('customer', 'n'), ('service', 'n'), ('contacted', 'v'), ('support', 'n'), ('team', 'n'), ('issue', 'n'), ('incredibly', 'r'), ('helpful', 'a'), ('replied', 'v'), ('quickly', 'r'), ('accommodating', 'v'), ('customer', 'n'), ('service', 'n'), ('teams', 'n'), ('seem', 'v'), ('ignore', 'r'), ('daysgiven', 'r'), ('budget', 'n'), ('price', 'n'), ('headphones', 'n'), ('would', 'n'), ('done', 'v'), ('recommend', 'v')]","['money', 'headphone', 'best', 'purchase', 'ever', 'make', 'sound', 'quality', 'go', 'best', 'audio', 'quality', 'price', 'amazingly', 'good', 'touch', 'control', 'little', 'tricky', 'get', 'use', 'still', 'nice', 'feature', 'passive', 'noise', 'cancellation', 'also', 'surprisingly', 'goodthe', 'headphone', 'easy', 'use', 'easy', 'pair', 'whilst', 'audiophiles', 'may', 'appreciate', 'audio', 'quality', 'think', 'people', 'perfectly', 'happy', 'especially', 'price', 'point', 'value', 'money', 'amazingthey', 'charge', 'wirelessly', 'different', 'tip', 'size', 'choose', 'earbuds', 'never', 'fall', 'earsmost', 'important', 'customer', 'service', 'contact', 'support', 'team', 'issue', 'incredibly', 'helpful', 'reply', 'quickly', 'accommodate', 'customer', 'service', 'team', 'seem', 'ignore', 'daysgiven', 'budget', 'price', 'headphone', 'would', 'do', 'recommend']",5,Positive,2
56,It's ok,ok,['ok'],"[('ok', 'n')]",['ok'],The right bud keeps falling out of my ear. Other than that it's fine so far.,right bud keeps falling ear fine far,"['right', 'bud', 'keeps', 'falling', 'ear', 'fine', 'far']","[('right', 'a'), ('bud', 'n'), ('keeps', 'n'), ('falling', 'v'), ('ear', 'a'), ('fine', 'n'), ('far', 'r')]","['right', 'bud', 'keep', 'fall', 'ear', 'fine', 'far']",4,Positive,2
57,Amazing value!!,amazing value,"['amazing', 'value']","[('amazing', 'v'), ('value', 'n')]","['amaze', 'value']","I got the pink ones and they’re lush!! The packaging they come in is very smart, would make a great present for someone! Love the fact they’re waterproof and they come with a nice selection of ear buds to make sure they fit :) theyre quite bass-heavy but I don’t mind this 😁 Overall very pleased 😁 the box is a nice design and holds the ear buds well, with lights to indicate the charge level xx",got pink ones lush packaging come smart would make great present someone love fact waterproof come nice selection ear buds make sure fit quite bassheavy mind overall pleased box nice design holds ear buds well lights indicate charge level xx,"['got', 'pink', 'ones', 'lush', 'packaging', 'come', 'smart', 'would', 'make', 'great', 'present', 'someone', 'love', 'fact', 'waterproof', 'come', 'nice', 'selection', 'ear', 'buds', 'make', 'sure', 'fit', 'quite', 'bassheavy', 'mind', 'overall', 'pleased', 'box', 'nice', 'design', 'holds', 'ear', 'buds', 'well', 'lights', 'indicate', 'charge', 'level', 'xx']","[('got', 'v'), ('pink', 'a'), ('ones', 'n'), ('lush', 'a'), ('packaging', 'n'), ('come', 'v'), ('smart', 'r'), ('would', 'n'), ('make', 'v'), ('great', 'a'), ('present', 'a'), ('someone', 'n'), ('love', 'n'), ('fact', 'n'), ('waterproof', 'n'), ('come', 'a'), ('nice', 'a'), ('selection', 'n'), ('ear', 'v'), ('buds', 'n'), ('make', 'v'), ('sure', 'a'), ('fit', 'a'), ('quite', 'n'), ('bassheavy', 'a'), ('mind', 'n'), ('overall', 'a'), ('pleased', 'a'), ('box', 'n'), ('nice', 'a'), ('design', 'n'), ('holds', 'v'), ('ear', 'a'), ('buds', 'r'), ('well', 'r'), ('lights', 'n'), ('indicate', 'v'), ('charge', 'n'), ('level', 'n'), ('xx', 'n')]","['get', 'pink', 'one', 'lush', 'packaging', 'come', 'smart', 'would', 'make', 'great', 'present', 'someone', 'love', 'fact', 'waterproof', 'come', 'nice', 'selection', 'ear', 'bud', 'make', 'sure', 'fit', 'quite', 'bassheavy', 'mind', 'overall', 'pleased', 'box', 'nice', 'design', 'hold', 'ear', 'buds', 'well', 'light', 'indicate', 'charge', 'level', 'xx']",4,Positive,2
